
mysql> create database EmployeeManagement1;
Query OK, 1 row affected (0.01 sec)

mysql> use employeemanagement1;
Database changed
mysql> CREATE TABLE Employees (sr INT PRIMARY KEY AUTO_INCREMENT, name VARCHAR(100) NOT NULL, email VARCHAR(100) UNIQUE NOT NULL, password VARCHAR(50) NOT NULL, salary DECIMAL(10,2) NOT NULL, department VARCHAR(100), department_id INT);
Query OK, 0 rows affected (0.05 sec)

mysql> INSERT INTO Employees (name, email, password, salary, department, department_id) VALUES
    -> ('Rahul Sharma','rahul.sharma@gmail.com','Rs@4521',45000.00,'IT',101),
    -> ('Priya Singh','priya.singh@gmail.com','Ps#8745',52000.00,'HR',102),
    -> ('Amit Verma','amit.verma@gmail.com','Av!1239',60000.00,'Finance',103),
    -> ('Neha Mehta','neha.mehta@gmail.com','Nm$9832',48000.00,'Marketing',104),
    -> ('Arjun Patel','arjun.patel@gmail.com','Ap@5566',70000.00,'Operations',105),
    -> ('Karan Gupta','karan.gupta@gmail.com','Kg#8822',55000.00,'IT',101),
    -> ('Sanya Malhotra','sanya.malhotra@gmail.com','Sm@2288',47000.00,'HR',102),
    -> ('Deepak Kumar','deepak.kumar@gmail.com','Dk!4455',65000.00,'Finance',103),
    -> ('Ritu Sharma','ritu.sharma@gmail.com','Rs#9921',49000.00,'Marketing',104),
    -> ('Manish Tiwari','manish.tiwari@gmail.com','Mt$1134',75000.00,'Operations',105),
    -> ('Anjali Singh','anjali.singh@gmail.com','As@7771',53000.00,'IT',101),
    -> ('Rohit Verma','rohit.verma@gmail.com','Rv!4499',68000.00,'Finance',103),
    -> ('Sneha Patil','sneha.patil@gmail.com','Sp$2244',46000.00,'HR',102),
    -> ('Abhishek Joshi','abhishek.joshi@gmail.com','Aj@6611',72000.00,'Operations',105),
    -> ('Kavita Desai','kavita.desai@gmail.com','Kd#3355',51000.00,'Marketing',104),
    -> ('Suresh Reddy','suresh.reddy@gmail.com','Sr$5577',62000.00,'Finance',103),
    -> ('Meera Krishnan','meera.krishnan@gmail.com','Mk!8829',48000.00,'HR',102),
    -> ('Vikram Chauhan','vikram.chauhan@gmail.com','Vc#6642',69000.00,'IT',101),
    -> ('Pooja Nair','pooja.nair@gmail.com','Pn$7788',54000.00,'Marketing',104),
    -> ('Harsh Raj','harsh.raj@gmail.com','Hr@9912',58000.00,'Operations',105),
    -> ('Rohan Kapoor','rohan.kapoor@gmail.com','Rk!2281',62000.00,'IT',101),
    -> ('Aisha Khan','aisha.khan@gmail.com','Ak#7765',49000.00,'HR',102),
    -> ('Nikhil Bansal','nikhil.bansal@gmail.com','Nb$5543',70000.00,'Finance',103),
    -> ('Shruti Jain','shruti.jain@gmail.com','Sj!3131',52000.00,'Marketing',104),
    -> ('Aditya Rao','aditya.rao@gmail.com','Ar@9112',73000.00,'Operations',105),
    -> ('Divya Sahu','divya.sahu@gmail.com','Ds#1212',48000.00,'HR',102),
    -> ('Sanjay Kulkarni','sanjay.kulkarni@gmail.com','Sk$7717',65000.00,'Finance',103),
    -> ('Naina Yadav','naina.yadav@gmail.com','Ny@8854',51000.00,'Marketing',104),
    -> ('Varun Malviya','varun.malviya@gmail.com','Vm#6644',60000.00,'IT',101),
    -> ('Ishita Chawla','ishita.chawla@gmail.com','Ic$9033',56000.00,'Operations',105);
Query OK, 30 rows affected (0.01 sec)
Records: 30  Duplicates: 0  Warnings: 0

mysql> show tables;
+-------------------------------+
| Tables_in_employeemanagement1 |
+-------------------------------+
| employees                     |
+-------------------------------+
1 row in set (0.00 sec)

mysql> show emplyees;
ERROR 1064 (42000): You have an error in your SQL syntax; check the manual that corresponds to your MySQL server version for the right syntax to use near 'emplyees' at line 1
mysql> employees;
ERROR 1064 (42000): You have an error in your SQL syntax; check the manual that corresponds to your MySQL server version for the right syntax to use near 'employees' at line 1
mysql> show employees;
ERROR 1064 (42000): You have an error in your SQL syntax; check the manual that corresponds to your MySQL server version for the right syntax to use near 'employees' at line 1
mysql> select * from  employess;
ERROR 1146 (42S02): Table 'employeemanagement1.employess' doesn't exist
mysql> select * from  employees;
+----+-----------------+---------------------------+----------+----------+------------+---------------+
| sr | name            | email                     | password | salary   | department | department_id |
+----+-----------------+---------------------------+----------+----------+------------+---------------+
|  1 | Rahul Sharma    | rahul.sharma@gmail.com    | Rs@4521  | 45000.00 | IT         |           101 |
|  2 | Priya Singh     | priya.singh@gmail.com     | Ps#8745  | 52000.00 | HR         |           102 |
|  3 | Amit Verma      | amit.verma@gmail.com      | Av!1239  | 60000.00 | Finance    |           103 |
|  4 | Neha Mehta      | neha.mehta@gmail.com      | Nm$9832  | 48000.00 | Marketing  |           104 |
|  5 | Arjun Patel     | arjun.patel@gmail.com     | Ap@5566  | 70000.00 | Operations |           105 |
|  6 | Karan Gupta     | karan.gupta@gmail.com     | Kg#8822  | 55000.00 | IT         |           101 |
|  7 | Sanya Malhotra  | sanya.malhotra@gmail.com  | Sm@2288  | 47000.00 | HR         |           102 |
|  8 | Deepak Kumar    | deepak.kumar@gmail.com    | Dk!4455  | 65000.00 | Finance    |           103 |
|  9 | Ritu Sharma     | ritu.sharma@gmail.com     | Rs#9921  | 49000.00 | Marketing  |           104 |
| 10 | Manish Tiwari   | manish.tiwari@gmail.com   | Mt$1134  | 75000.00 | Operations |           105 |
| 11 | Anjali Singh    | anjali.singh@gmail.com    | As@7771  | 53000.00 | IT         |           101 |
| 12 | Rohit Verma     | rohit.verma@gmail.com     | Rv!4499  | 68000.00 | Finance    |           103 |
| 13 | Sneha Patil     | sneha.patil@gmail.com     | Sp$2244  | 46000.00 | HR         |           102 |
| 14 | Abhishek Joshi  | abhishek.joshi@gmail.com  | Aj@6611  | 72000.00 | Operations |           105 |
| 15 | Kavita Desai    | kavita.desai@gmail.com    | Kd#3355  | 51000.00 | Marketing  |           104 |
| 16 | Suresh Reddy    | suresh.reddy@gmail.com    | Sr$5577  | 62000.00 | Finance    |           103 |
| 17 | Meera Krishnan  | meera.krishnan@gmail.com  | Mk!8829  | 48000.00 | HR         |           102 |
| 18 | Vikram Chauhan  | vikram.chauhan@gmail.com  | Vc#6642  | 69000.00 | IT         |           101 |
| 19 | Pooja Nair      | pooja.nair@gmail.com      | Pn$7788  | 54000.00 | Marketing  |           104 |
| 20 | Harsh Raj       | harsh.raj@gmail.com       | Hr@9912  | 58000.00 | Operations |           105 |
| 21 | Rohan Kapoor    | rohan.kapoor@gmail.com    | Rk!2281  | 62000.00 | IT         |           101 |
| 22 | Aisha Khan      | aisha.khan@gmail.com      | Ak#7765  | 49000.00 | HR         |           102 |
| 23 | Nikhil Bansal   | nikhil.bansal@gmail.com   | Nb$5543  | 70000.00 | Finance    |           103 |
| 24 | Shruti Jain     | shruti.jain@gmail.com     | Sj!3131  | 52000.00 | Marketing  |           104 |
| 25 | Aditya Rao      | aditya.rao@gmail.com      | Ar@9112  | 73000.00 | Operations |           105 |
| 26 | Divya Sahu      | divya.sahu@gmail.com      | Ds#1212  | 48000.00 | HR         |           102 |
| 27 | Sanjay Kulkarni | sanjay.kulkarni@gmail.com | Sk$7717  | 65000.00 | Finance    |           103 |
| 28 | Naina Yadav     | naina.yadav@gmail.com     | Ny@8854  | 51000.00 | Marketing  |           104 |
| 29 | Varun Malviya   | varun.malviya@gmail.com   | Vm#6644  | 60000.00 | IT         |           101 |
| 30 | Ishita Chawla   | ishita.chawla@gmail.com   | Ic$9033  | 56000.00 | Operations |           105 |
+----+-----------------+---------------------------+----------+----------+------------+---------------+
30 rows in set (0.00 sec)

mysql> SELECT * FROM Employees WHERE sr = 5;
+----+-------------+-----------------------+----------+----------+------------+---------------+
| sr | name        | email                 | password | salary   | department | department_id |
+----+-------------+-----------------------+----------+----------+------------+---------------+
|  5 | Arjun Patel | arjun.patel@gmail.com | Ap@5566  | 70000.00 | Operations |           105 |
+----+-------------+-----------------------+----------+----------+------------+---------------+
1 row in set (0.00 sec)

mysql> SELECT * FROM Employees WHERE salary > 60000;
+----+-----------------+---------------------------+----------+----------+------------+---------------+
| sr | name            | email                     | password | salary   | department | department_id |
+----+-----------------+---------------------------+----------+----------+------------+---------------+
|  5 | Arjun Patel     | arjun.patel@gmail.com     | Ap@5566  | 70000.00 | Operations |           105 |
|  8 | Deepak Kumar    | deepak.kumar@gmail.com    | Dk!4455  | 65000.00 | Finance    |           103 |
| 10 | Manish Tiwari   | manish.tiwari@gmail.com   | Mt$1134  | 75000.00 | Operations |           105 |
| 12 | Rohit Verma     | rohit.verma@gmail.com     | Rv!4499  | 68000.00 | Finance    |           103 |
| 14 | Abhishek Joshi  | abhishek.joshi@gmail.com  | Aj@6611  | 72000.00 | Operations |           105 |
| 16 | Suresh Reddy    | suresh.reddy@gmail.com    | Sr$5577  | 62000.00 | Finance    |           103 |
| 18 | Vikram Chauhan  | vikram.chauhan@gmail.com  | Vc#6642  | 69000.00 | IT         |           101 |
| 21 | Rohan Kapoor    | rohan.kapoor@gmail.com    | Rk!2281  | 62000.00 | IT         |           101 |
| 23 | Nikhil Bansal   | nikhil.bansal@gmail.com   | Nb$5543  | 70000.00 | Finance    |           103 |
| 25 | Aditya Rao      | aditya.rao@gmail.com      | Ar@9112  | 73000.00 | Operations |           105 |
| 27 | Sanjay Kulkarni | sanjay.kulkarni@gmail.com | Sk$7717  | 65000.00 | Finance    |           103 |
+----+-----------------+---------------------------+----------+----------+------------+---------------+
11 rows in set (0.00 sec)

mysql> SELECT name, email FROM Employees;
+-----------------+---------------------------+
| name            | email                     |
+-----------------+---------------------------+
| Rahul Sharma    | rahul.sharma@gmail.com    |
| Priya Singh     | priya.singh@gmail.com     |
| Amit Verma      | amit.verma@gmail.com      |
| Neha Mehta      | neha.mehta@gmail.com      |
| Arjun Patel     | arjun.patel@gmail.com     |
| Karan Gupta     | karan.gupta@gmail.com     |
| Sanya Malhotra  | sanya.malhotra@gmail.com  |
| Deepak Kumar    | deepak.kumar@gmail.com    |
| Ritu Sharma     | ritu.sharma@gmail.com     |
| Manish Tiwari   | manish.tiwari@gmail.com   |
| Anjali Singh    | anjali.singh@gmail.com    |
| Rohit Verma     | rohit.verma@gmail.com     |
| Sneha Patil     | sneha.patil@gmail.com     |
| Abhishek Joshi  | abhishek.joshi@gmail.com  |
| Kavita Desai    | kavita.desai@gmail.com    |
| Suresh Reddy    | suresh.reddy@gmail.com    |
| Meera Krishnan  | meera.krishnan@gmail.com  |
| Vikram Chauhan  | vikram.chauhan@gmail.com  |
| Pooja Nair      | pooja.nair@gmail.com      |
| Harsh Raj       | harsh.raj@gmail.com       |
| Rohan Kapoor    | rohan.kapoor@gmail.com    |
| Aisha Khan      | aisha.khan@gmail.com      |
| Nikhil Bansal   | nikhil.bansal@gmail.com   |
| Shruti Jain     | shruti.jain@gmail.com     |
| Aditya Rao      | aditya.rao@gmail.com      |
| Divya Sahu      | divya.sahu@gmail.com      |
| Sanjay Kulkarni | sanjay.kulkarni@gmail.com |
| Naina Yadav     | naina.yadav@gmail.com     |
| Varun Malviya   | varun.malviya@gmail.com   |
| Ishita Chawla   | ishita.chawla@gmail.com   |
+-----------------+---------------------------+
30 rows in set (0.00 sec)

mysql> UPDATE Employees
    -> SET salary = 75000
    -> WHERE sr = 2;
Query OK, 1 row affected (0.01 sec)
Rows matched: 1  Changed: 1  Warnings: 0

mysql> UPDATE Employees
    -> SET department = 'Finance', department_id = 103
    -> WHERE sr = 4;
Query OK, 1 row affected (0.01 sec)
Rows matched: 1  Changed: 1  Warnings: 0

mysql> UPDATE Employees
    -> SET password = 'NewPass@123'
    -> WHERE sr = 1;
Query OK, 1 row affected (0.01 sec)
Rows matched: 1  Changed: 1  Warnings: 0

mysql> DELETE FROM Employees WHERE department = 'HR';
Query OK, 6 rows affected (0.01 sec)

mysql> SELECT COUNT(*) AS total_employees FROM Employees;
+-----------------+
| total_employees |
+-----------------+
|              24 |
+-----------------+
1 row in set (0.01 sec)

mysql> SELECT MAX(salary) AS highest_salary FROM Employees;
+----------------+
| highest_salary |
+----------------+
|       75000.00 |
+----------------+
1 row in set (0.00 sec)

mysql> SELECT department, AVG(salary) AS avg_salary
    -> FROM Employees
    -> GROUP BY department;
+------------+--------------+
| department | avg_salary   |
+------------+--------------+
| IT         | 57333.333333 |
| Finance    | 62571.428571 |
| Operations | 67333.333333 |
| Marketing  | 51400.000000 |
+------------+--------------+
4 rows in set (0.00 sec)

mysql> SELECT * FROM Employees
    -> ORDER BY salary DESC;
+----+-----------------+---------------------------+-------------+----------+------------+---------------+
| sr | name            | email                     | password    | salary   | department | department_id |
+----+-----------------+---------------------------+-------------+----------+------------+---------------+
| 10 | Manish Tiwari   | manish.tiwari@gmail.com   | Mt$1134     | 75000.00 | Operations |           105 |
| 25 | Aditya Rao      | aditya.rao@gmail.com      | Ar@9112     | 73000.00 | Operations |           105 |
| 14 | Abhishek Joshi  | abhishek.joshi@gmail.com  | Aj@6611     | 72000.00 | Operations |           105 |
|  5 | Arjun Patel     | arjun.patel@gmail.com     | Ap@5566     | 70000.00 | Operations |           105 |
| 23 | Nikhil Bansal   | nikhil.bansal@gmail.com   | Nb$5543     | 70000.00 | Finance    |           103 |
| 18 | Vikram Chauhan  | vikram.chauhan@gmail.com  | Vc#6642     | 69000.00 | IT         |           101 |
| 12 | Rohit Verma     | rohit.verma@gmail.com     | Rv!4499     | 68000.00 | Finance    |           103 |
|  8 | Deepak Kumar    | deepak.kumar@gmail.com    | Dk!4455     | 65000.00 | Finance    |           103 |
| 27 | Sanjay Kulkarni | sanjay.kulkarni@gmail.com | Sk$7717     | 65000.00 | Finance    |           103 |
| 16 | Suresh Reddy    | suresh.reddy@gmail.com    | Sr$5577     | 62000.00 | Finance    |           103 |
| 21 | Rohan Kapoor    | rohan.kapoor@gmail.com    | Rk!2281     | 62000.00 | IT         |           101 |
|  3 | Amit Verma      | amit.verma@gmail.com      | Av!1239     | 60000.00 | Finance    |           103 |
| 29 | Varun Malviya   | varun.malviya@gmail.com   | Vm#6644     | 60000.00 | IT         |           101 |
| 20 | Harsh Raj       | harsh.raj@gmail.com       | Hr@9912     | 58000.00 | Operations |           105 |
| 30 | Ishita Chawla   | ishita.chawla@gmail.com   | Ic$9033     | 56000.00 | Operations |           105 |
|  6 | Karan Gupta     | karan.gupta@gmail.com     | Kg#8822     | 55000.00 | IT         |           101 |
| 19 | Pooja Nair      | pooja.nair@gmail.com      | Pn$7788     | 54000.00 | Marketing  |           104 |
| 11 | Anjali Singh    | anjali.singh@gmail.com    | As@7771     | 53000.00 | IT         |           101 |
| 24 | Shruti Jain     | shruti.jain@gmail.com     | Sj!3131     | 52000.00 | Marketing  |           104 |
| 15 | Kavita Desai    | kavita.desai@gmail.com    | Kd#3355     | 51000.00 | Marketing  |           104 |
| 28 | Naina Yadav     | naina.yadav@gmail.com     | Ny@8854     | 51000.00 | Marketing  |           104 |
|  9 | Ritu Sharma     | ritu.sharma@gmail.com     | Rs#9921     | 49000.00 | Marketing  |           104 |
|  4 | Neha Mehta      | neha.mehta@gmail.com      | Nm$9832     | 48000.00 | Finance    |           103 |
|  1 | Rahul Sharma    | rahul.sharma@gmail.com    | NewPass@123 | 45000.00 | IT         |           101 |
+----+-----------------+---------------------------+-------------+----------+------------+---------------+
24 rows in set (0.00 sec)

mysql>